date,text,score,comments,url,subreddit,id,type,sentiment_compound,sentiment_positive,sentiment_negative,sentiment_neutral,sentiment_class,sentiment_confidence
2025-03-25 03:21:16,"ETH Token Utility Is Deteriorating: A Rollup-Centric Ethereum Needs Rethinking This is not a price discussion about ETH token —this post focuses on Ethereum's evolving architecture and how current design choices affect ETH’s role within the protocol.

Specifically, I wanted to discuss (hopefully with Ethereum Foundation members and the community here) how Ethereum’s shift toward a rollup-centric architecture—combined with sequencer economics and abstracted fee mechanisms—is steadily eroding the utility of ETH as a protocol asset. As transaction execution moves off-chain and value accrues to application and infrastructure layers, ETH is becoming economically obsolete within its own ecosystem, reduced to a passive settlement token with declining relevance.

\_

Ethereum’s recent market underperformance reflects underlying architectural and economic challenges—namely, an increasing divergence between protocol-level activity and value accrual to the ETH token. As Ethereum transitions toward a modular architecture, with execution increasingly offloaded to Layer 2 rollups and sidechains, the locus of network activity and fee generation is shifting away from the base layer. This raises critical questions about ETH’s function as a utility and capital asset within a system where settlement and data availability remain on L1, but economic activity is abstracted and fragmented across secondary layers.

Layer 2 networks and Ethereum-adjacent sidechains increasingly leverage Ethereum’s ecosystem—its security model, TVL, and EVM compatibility—while largely bypassing ETH as a core economic asset. These platforms benefit from Ethereum’s ecosystem, but redirect liquidity, transaction volume, and value accrual to their own native tokens and network.

Polygon, for example, positioned itself early on as an Ethereum scaling solution and received support from Ethereum Foundation + Vitalik. However, its architecture relies on its own validators, consensus model, and token (MATIC/POL), which is used for both transaction fees and staking. As a result, Polygon leeches from Ethereum's network, TVL, and developer network without reinforcing ETH as a utility token or contributing to the security of Ethereum mainnet.

L2 solutions such as Base, Arbitrum, and Optimism are structurally closer to Ethereum, in that they settle data to Layer 1. However, their economic models often do not reinforce ETH demand in a meaningful way. Sequencers collect fees and periodically post transaction data to Ethereum mainnet using ETH or their own native UI currencies—but in many cases (e.g., Coinbase’s Base), this ETH is sold immediately. The result is an increase in ETH-denominated sell pressure for using a L2 network without any corresponding increase in demand or utility. The amount of ETH burned is extremely small compared to the value being moved across these L2s. For billions in daily transaction volume, the total ETH burned is typically in the hundreds to low thousands per month. So while ETH is used, it’s economically disproportionate to the scale of activity happening off-chain.

Moreover, the abstraction of ETH from end users further erodes its role as a utility token. If rollups and applications can operate entirely using other network-specific tokens, and if ETH is only used behind the scenes (and immediately sold), its function as a transactional or capital asset becomes increasingly marginal. In effect, ETH risks being reduced to a mere settlement token for rollup operators, rather than a broadly used currency or store of value within the ecosystem.

The Ethereum Foundation continues to champion a rollup-centric roadmap as the path toward scalable, decentralized infrastructure. While this model offers tangible benefits—lower transaction costs/higher throughput—it also creates new economic trade-offs. Value accrual shifts to application and infrastructure layers, rather than consolidating around the base protocol asset (ETH). This is a departure from Ethereum’s earlier design assumptions, where ETH was envisioned as a multi-functional asset: the native gas token, staking collateral, medium of exchange, and reserve currency for decentralized applications.

As a long-time participant in the Ethereum ecosystem (since 2015-2016 or so), I’ve observed this shift with increasing concern—not due to a lack of technical progress, but due to the weakening alignment between protocol growth and ETH value. Ethereum is scaling, but ETH is not capturing the upside of that scale. Competing ecosystems—such as Solana or vertically integrated L1s—are increasingly offering tighter economic alignment between usage and token utility, which may present challenges to Ethereum’s long-term competitiveness.

This is a critical juncture. Ethereum must balance scalability with economic coherence. If Ethereum becomes primarily a settlement layer for EVM-compatible rollups that abstract away ETH, then ETH’s utility—and by extension, its long-term value proposition—will disappear.

\_

TL;DR: ETH is being abstracted away from Ethereum network + ecosystem usage, and needs to be fixed.

I'm highlighting a critical design problem where there’s a growing disconnect between network expansion and economic incentives for the ETH token.

This is fundamentally an architectural/incentive issue that needs to be addressed to preserve ETH’s role (the token ETH not the network) in the new age of a rollup-centric ethereum, (and not be completely abstracted away)

in the comments I've outlined potential solutions—such as ETH-denominated fee-sharing models and collateral requirements for L2 sequencers—that would re-align ETH with L2 usage. Today, the Ethereum Ecosystem is growing, but ETH utility continues deteriorate as the token is sidelined from actual transaction flow and user interaction on l2s.",15,52,https://www.reddit.com/r/ethereum/comments/1jja457/eth_token_utility_is_deteriorating_a/,ethereum,1jja457,post,0.9965,0.111,0.033,0.856,1,0.856
2025-03-25 03:21:17,"WARNING ABOUT SCAMS:  Recently there have been a lot of convincing-looking scams posted on crypto-related reddits including fake NFTs, fake credit cards, fake exchanges, fake mixing services, fake airdrops, fake MEV bots, fake ENS sites and scam sites claiming to help you revoke approvals to prevent fake hacks. These are typically upvoted by bots and seen before moderators can remove them. Do not click on these links and always be wary of anything that tries to rush you into sending money or approving contracts.


*I am a bot, and this action was performed automatically. Please [contact the moderators of this subreddit](/message/compose/?to=/r/ethereum) if you have any questions or concerns.*",1,0,https://www.reddit.com/r/ethereum/comments/1jja457/eth_token_utility_is_deteriorating_a/mjljace/,ethereum,mjljace,comment,-0.9864,0.063,0.288,0.649,-1,0.649
2025-03-25 03:34:28,"Yes and no. The fact that ETH is the backbone of so many other layers of the Web3 ecosystem is, in its own way, more meaningful in terms of staying power than any other currency.",28,0,https://www.reddit.com/r/ethereum/comments/1jja457/eth_token_utility_is_deteriorating_a/mjll5dc/,ethereum,mjll5dc,comment,0.4754,0.134,0.056,0.81,1,0.81
2025-03-25 04:14:16,">reduced to a passive settlement token with declining relevance.

You mean: the only token used to settle L2 transactions on L1, thus ensuring its relevancy long term? This is like saying VISA is irrelevant because they ""only"" settle transactions between acquiring banks and issuing banks.

>raising important questions about ETH’s role and utility within this new paradigm.

eth's role is as the currency of payment for performing work on the ethereum L1 blockchain. With the advent of L2s, that is shifting more to a settlement layer while maintaining security and decentralisation, since the L2s are handling scalability. I don't think anyone is questioning this role, or eth's utility. This reads like FUD.

>their \[L2s\] economic models often do not reinforce ETH demand in a meaningful way

No, because that's not their job... Their job is to scale the ethereum network, utilising L1 and eth as a settlement layer. Propping up the value of eth is not their aim, so I'm not sure why you would think to even list this as an issue?

>the abstraction of ETH from end users further erodes its role as a utility token

Nonsense. Eth is trivially available to end users and has the same utility as ever.

>if ETH is only used behind the scenes (and immediately sold)

Eth being sold doesn't mean it disappears... it's sold to someone else who then uses it for its intended purpose.

>its function as a transactional or capital asset becomes increasingly marginal

Neither of which is a goal of eth. See above, re: eth's role

>ETH risks being reduced to a mere settlement token for rollup operators, rather than a broadly used currency or store of value within the ecosystem.

Much like oil in the global economy... hey, maybe that's why transaction fees are paid for with ""gas""!

>Competing ecosystems—such as Solana or vertically integrated L1s—are increasingly offering tighter economic alignment between usage and token utility, which may present challenges to Ethereum’s long-term competitiveness

All I'm reading here is that the price of sol is artificially and unnecessarily high compared to eth. As above, ethereum's long-term competitiveness is as a settlement layer.

>If Ethereum becomes primarily a settlement layer for EVM-compatible rollups that abstract away ETH, then ETH’s utility—and by extension, its long-term value proposition—will disappear.

No, eth's utility remains the same... anyone can purchase it and use it in a variety of ways, including interacting directly with L1. It's long term value proposition is also unchanged. Eth is and has always afaik positioned itself as the oil, to bitcoin's gold. Imagine saying all this stuff about oil? That's how you sound to me.",17,0,https://www.reddit.com/r/ethereum/comments/1jja457/eth_token_utility_is_deteriorating_a/mjlqggd/,ethereum,mjlqggd,comment,0.9238,0.077,0.039,0.884,1,0.884
2025-03-25 04:05:49,"Onboard the world onto Ethereum now, care about fee revenue later. Even with gas at 1 gwei Ethereum is less inflationary than BTC and even L1 is cheap to transact on, so I don't see where the problem is. We're just allowing devs and users to find *that thing* that will onboard the whole world onto Ethereum, then you can start caring about fee revenue but you won't need to and won't even remember this post.",13,0,https://www.reddit.com/r/ethereum/comments/1jja457/eth_token_utility_is_deteriorating_a/mjlpdc9/,ethereum,mjlpdc9,comment,0.3291,0.055,0.024,0.921,1,0.921
2025-03-25 07:29:09,"The time to post things like this was in 2020 when the rollup roadmap was discussed, or 2021 and 2024 when the price was at peak. 


To be reactive to price action makes no sense here.


Some of your points even seem straight out from 2020. Polygon has not been relevant for many years. They're a dying chain who may have gotten some mainstream media press in Polymarket, but in practice volume and activity is steadily losing out to actual rollups.


Other points are plain misinformed. Base has not been selling the ETH it accrues.


More importantly, Optimism, Arbitrum and Base do NOT have native UI currencies as you seem to believe. They use ETH for gas.


This is true for the vast majority of rollups. Some gas abstraction solutions exist, but they're used in microscopic volume. The only two rollups I can recall off the top of my head with their own gas token is Metis and... some other irrelevant one I can't even remember.


You claim you are a longtime participant in this ecosystem. As an actual daily user of Ethereum, I suspect your participation is limited to having bought coins early on, and you do not actually use Ethereum. 


I suggest using Ethereum. It will clear up many of your misconceptions, and you will be in a much better position to judge the roadmap.",6,0,https://www.reddit.com/r/ethereum/comments/1jja457/eth_token_utility_is_deteriorating_a/mjmak7o/,ethereum,mjmak7o,comment,0.9247,0.109,0.055,0.836,1,0.836
2025-03-25 06:37:39,"I appreciate the thought and effort you've put into this post. I have a question about something you said. I hope it's not too basic of a question.

You said:

Sequencers collect fees and periodically post transaction data to Ethereum mainnet using ETH-but in many cases (e.g., Coinbase's Base), this ETH is sold rather than staked or reinvested within the ecosystem.

Don't L2s have to pay fees in ETH to settle on L1? When you say ""meaningful way"" do you mean that this amounts to a negligible amount compared to the total value that moves in L2s?

What do you mean when you say this eth is sold rather than reinvested or stacked?",3,0,https://www.reddit.com/r/ethereum/comments/1jja457/eth_token_utility_is_deteriorating_a/mjm5thj/,ethereum,mjm5thj,comment,0.857,0.095,0.012,0.893,1,0.893
2025-03-25 05:38:55,"“This is not a price discussion about ETH token” - proceeds to talk exclusively about why the price might be low.

The price of ETH is secondary. It needs to be high enough to secure the chain, and it is. Scaling through L2s works amazingly well. Cross-L2 UX needs to get 10x better. That’s the kind of thing that matters to users.",5,0,https://www.reddit.com/r/ethereum/comments/1jja457/eth_token_utility_is_deteriorating_a/mjm049o/,ethereum,mjm049o,comment,0.6901,0.133,0.032,0.835,1,0.835
2025-03-25 07:27:34,Imagine thinking prices are driven by token Utility instead of narratives.,2,0,https://www.reddit.com/r/ethereum/comments/1jja457/eth_token_utility_is_deteriorating_a/mjmaf4h/,ethereum,mjmaf4h,comment,0.0,0.0,0.0,1.0,0,1.0
2025-03-25 07:39:16,"As a fellow follower of the Ethereum development since 2017, I still have issues to understand its real world use case. The concept of decentralized ownership never materialized nor any dApp has been really disruptive on a global scale. People use Ethereum to create their own tokens instead.

I will get downvoted but I will argue that ETH as a store of value lost the competition against Bitcoin. Would you save your economic energy in ETH rather than BTC ?",1,0,https://www.reddit.com/r/ethereum/comments/1jja457/eth_token_utility_is_deteriorating_a/mjmbgh0/,ethereum,mjmbgh0,comment,0.5794,0.136,0.092,0.772,1,0.772
2025-03-25 07:58:43,"The rollup centric roadmap was less a shift away from the original goals and more about a prediction: that by the time Ethereum implemented proper sharding, everyone would already be using rollups and no one would care about the shards. That prediction doesn’t seem to be totally accurate, but the amount of activity around developing rollups is advancing the R&D necessary to make shards happen much faster than if it was only the client teams and eth magicians working on it. The existence of rollups was inevitable though, they weren’t a direction that was decided on, it was an inevitable evolution of the space that ethereum could choose to leverage. Ethereum positioned itself as the de facto security and coordination layer of rollups. If it hadn’t done that, the rollups would still exist, but ethereum may not have been where they rolled up into. 

Rollups are not parasites to be tariffed, they are allies that have the same long term vision and principals we do. They’re following the lead of ethereum, and that kind of power can only be earned. Growing together towards a shared goal is, and has always been, the best way forward.

The crypto market is filled with people trying to get rich quick. It’s not a rational long term prediction of Ethereum or crypto. ",1,0,https://www.reddit.com/r/ethereum/comments/1jja457/eth_token_utility_is_deteriorating_a/mjmd79v/,ethereum,mjmd79v,comment,0.9738,0.109,0.007,0.884,1,0.884
2025-03-21 08:34:23,"What's considered the best L2 right now? Guys, I was out of the loop for a few years so I need to understand what is the consensus right now on what is the best layer 2 on Ethereum right now?

I was always using polygon before but It was before any competition we have now.

Or they are not interchangeable and all cover their use case? ",17,30,https://www.reddit.com/r/ethereum/comments/1jgc519/whats_considered_the_best_l2_right_now/,ethereum,1jgc519,post,0.6946,0.089,0.0,0.911,1,0.911
2025-03-21 08:34:24,"WARNING ABOUT SCAMS:  Recently there have been a lot of convincing-looking scams posted on crypto-related reddits including fake NFTs, fake credit cards, fake exchanges, fake mixing services, fake airdrops, fake MEV bots, fake ENS sites and scam sites claiming to help you revoke approvals to prevent fake hacks. These are typically upvoted by bots and seen before moderators can remove them. Do not click on these links and always be wary of anything that tries to rush you into sending money or approving contracts.


*I am a bot, and this action was performed automatically. Please [contact the moderators of this subreddit](/message/compose/?to=/r/ethereum) if you have any questions or concerns.*",1,0,https://www.reddit.com/r/ethereum/comments/1jgc519/whats_considered_the_best_l2_right_now/mixxipq/,ethereum,mixxipq,comment,-0.9864,0.063,0.288,0.649,-1,0.649
2025-03-21 09:34:20,"Optimistic rollups had the first mover advantage, and Arbitrum, Optimsm and Base are the largest ones.

ZK released a bit later and have fewer users, but many believe it to be the superior tech. ZkSync and  Starknet are two of the larger ones here.

You can check stats on l2beat dot Com, you'll see all L2's, how secure/decentralised they are, how many users, TVL etc.",22,0,https://www.reddit.com/r/ethereum/comments/1jgc519/whats_considered_the_best_l2_right_now/miy35hj/,ethereum,miy35hj,comment,0.7845,0.115,0.0,0.885,1,0.885
2025-03-21 10:38:57,"Have a look through [l2beat.com](https://l2beat.com/scaling/summary) and [fees.growthepie.xyz](https://fees.growthepie.xyz/) then you tell us.

Key metrics are:

* Fee cost
* TVL
* UOPS/TPS

If you want a single ""best"" L2 and just wanna play around, I'd suggest Base.",14,0,https://www.reddit.com/r/ethereum/comments/1jgc519/whats_considered_the_best_l2_right_now/miy9wg2/,ethereum,miy9wg2,comment,0.4019,0.113,0.0,0.887,1,0.887
2025-03-21 09:08:16,"Do you want to create NFTs or Tokens? Do you want to trade many assets? Do you want to use DeFi protocols?

Know what you want to do to make a better choice.",3,0,https://www.reddit.com/r/ethereum/comments/1jgc519/whats_considered_the_best_l2_right_now/miy0omc/,ethereum,miy0omc,comment,0.8146,0.332,0.0,0.668,1,0.668
2025-03-21 14:49:50,I haven't heard a bad thing about BASE. It's stupidly easy to use.,3,0,https://www.reddit.com/r/ethereum/comments/1jgc519/whats_considered_the_best_l2_right_now/mizdpya/,ethereum,mizdpya,comment,0.4118,0.343,0.179,0.478,1,0.478
2025-03-21 21:21:48,You’re going to have to be more specific. Fastest? Cheapest? Most decentralized? Most usage? Best dapps? Most likely to airdrop a token? Most likely to have existing token appreciate in price?,2,0,https://www.reddit.com/r/ethereum/comments/1jgc519/whats_considered_the_best_l2_right_now/mj1lye9/,ethereum,mj1lye9,comment,0.8457,0.225,0.0,0.775,1,0.775
2025-03-22 04:55:44,Check out Sophon,2,0,https://www.reddit.com/r/ethereum/comments/1jgc519/whats_considered_the_best_l2_right_now/mj3msff/,ethereum,mj3msff,comment,0.0,0.0,0.0,1.0,0,1.0
2025-03-23 18:53:49,Base imo,2,0,https://www.reddit.com/r/ethereum/comments/1jgc519/whats_considered_the_best_l2_right_now/mjcquk2/,ethereum,mjcquk2,comment,0.0,0.0,0.0,1.0,0,1.0
2025-03-21 18:49:45,"There is such thing as "" the best L2"". There is a brtter-suited L2 for a use case (or several ones).

That's the beauty of the rollups. A rollup can be developed for a specific use case, while relying on L1's security. Product innovation will happen on L2.",1,0,https://www.reddit.com/r/ethereum/comments/1jgc519/whats_considered_the_best_l2_right_now/mj0rcq1/,ethereum,mj0rcq1,comment,0.9186,0.25,0.0,0.75,1,0.75
2025-03-21 20:11:48,Base,1,0,https://www.reddit.com/r/ethereum/comments/1jgc519/whats_considered_the_best_l2_right_now/mj184hy/,ethereum,mj184hy,comment,0.0,0.0,0.0,1.0,0,1.0
