date,text,score,comments,url,subreddit,id,type,sentiment_compound,sentiment_positive,sentiment_negative,sentiment_neutral,sentiment_class,sentiment_confidence
2025-03-22 10:09:01,Polygon Flips Base in March! 914K USDC Users vs 639K on Base - Polygon Climbs from 6th to 2nd in Just 9 Months! ,55,28,https://www.reddit.com/gallery/1jh588a,CryptoCurrency,1jh588a,post,0.0,0.0,0.0,1.0,0,1.0
2025-03-22 10:22:59,"The question is, when will this affect the price? I'm still averaging mine.",17,0,https://www.reddit.com/r/CryptoCurrency/comments/1jh588a/polygon_flips_base_in_march_914k_usdc_users_vs/mj4hr5p/,CryptoCurrency,mj4hr5p,comment,0.0,0.0,0.0,1.0,0,1.0
2025-03-22 11:52:54,"While the post highlights Polygon's user growth, it is crucial to note that a significant portion of its new users may not be retained; 68% of the 3 million added through Reddit’s NFT avatars haven't made a subsequent transaction. This raises questions about the sustainability of Polygon's user growth amidst competition and its institutional strategies, particularly as it aims to maintain a 22% quarterly growth in daily active wallets.

* [How Many Cryptocurrencies Are There in March 2025? | Tangem Blog](https://tangem.com/en/blog/post/how-many-cryptocurrencies-exist/)
* [Is Polygon a Good Investment Right Now and Long-Term - Cryptomus](https://cryptomus.com/blog/is-polygon-a-good-investment?srsltid=AfmBOoqEguBW855TMg5ZraXS4HODGbWj1Iqy7N0QeJMGIEVZ9YlUDKsU)
* [Polygon Blog | Announcements, updates, and news](https://polygon.technology/blog)

^(This is a bot made by [Critique AI](https://critique-labs.ai). If you want vetted information like this on all content you browse, [download our extension](https://critiquebrowser.app).)",7,0,https://www.reddit.com/r/CryptoCurrency/comments/1jh588a/polygon_flips_base_in_march_914k_usdc_users_vs/mj4r6qf/,CryptoCurrency,mj4r6qf,comment,0.9459,0.157,0.009,0.834,1,0.834
2025-03-22 10:37:55,This should impact the price right? ...right?,5,0,https://www.reddit.com/r/CryptoCurrency/comments/1jh588a/polygon_flips_base_in_march_914k_usdc_users_vs/mj4j614/,CryptoCurrency,mj4j614,comment,0.0,0.0,0.0,1.0,0,1.0
2025-03-22 17:09:16,"Users, contract deployments, transactions , etc are the easiest and cheapest metrics to manipulate. I remember when avalanche launched 90m contracts in one day and everyone loved it like it meant something. 

TVL is one metric to look at or flow of funds in one way or another",2,0,https://www.reddit.com/r/CryptoCurrency/comments/1jh588a/polygon_flips_base_in_march_914k_usdc_users_vs/mj68p2h/,CryptoCurrency,mj68p2h,comment,0.8658,0.203,0.0,0.797,1,0.797
2025-03-22 10:09:10,"Sources:

* Tweet [https://x.com/obchakevich\_/status/1903120168802300074](https://x.com/obchakevich_/status/1903120168802300074)
* Dune: [https://dune.com/obchakevich/usdt-usdc-users](https://dune.com/obchakevich/usdt-usdc-users)",1,0,https://www.reddit.com/r/CryptoCurrency/comments/1jh588a/polygon_flips_base_in_march_914k_usdc_users_vs/mj4ggdo/,CryptoCurrency,mj4ggdo,comment,0.0,0.0,0.0,1.0,0,1.0
2025-03-22 10:46:50,"I feel like this was caused by the price crash though and many people were swapping to a stable to hold whatever value they could to buy back in later and hopefully not have lost as much. 

Things were much different 9 months ago, let’s see if this trend continues.",1,0,https://www.reddit.com/r/CryptoCurrency/comments/1jh588a/polygon_flips_base_in_march_914k_usdc_users_vs/mj4k1bt/,CryptoCurrency,mj4k1bt,comment,0.7942,0.212,0.049,0.739,1,0.739
2025-03-22 10:50:01,But the price isn’t moving in the right direction.,1,0,https://www.reddit.com/r/CryptoCurrency/comments/1jh588a/polygon_flips_base_in_march_914k_usdc_users_vs/mj4kcpc/,CryptoCurrency,mj4kcpc,comment,0.0,0.0,0.0,1.0,0,1.0
2025-03-22 12:39:46,"Are comparisons between the numbers of USDC users on two chains actually any halfway decent metric? Like, on some chains USDT is more popular, or even the native token might be better to compare.",1,0,https://www.reddit.com/r/CryptoCurrency/comments/1jh588a/polygon_flips_base_in_march_914k_usdc_users_vs/mj4x9yx/,CryptoCurrency,mj4x9yx,comment,0.8173,0.215,0.0,0.785,1,0.785
2025-03-22 14:20:23,"BOTH built on ethereum, i might add...",1,0,https://www.reddit.com/r/CryptoCurrency/comments/1jh588a/polygon_flips_base_in_march_914k_usdc_users_vs/mj5d6ms/,CryptoCurrency,mj5d6ms,comment,0.0,0.0,0.0,1.0,0,1.0
2025-03-22 20:14:37,Man polygon has been such a big L. I was taking matic as my  crypto kickback from the Coinbase card back in the day. Wish I got BTC instead since they didn't offer sol,1,0,https://www.reddit.com/r/CryptoCurrency/comments/1jh588a/polygon_flips_base_in_march_914k_usdc_users_vs/mj77s6t/,CryptoCurrency,mj77s6t,comment,0.4019,0.083,0.0,0.917,1,0.917
2025-03-23 18:55:05,The Tokenization Revolution: Reshaping How We Own and Trade Assets ,122,11,https://www.entrepreneur.com/en-au/news-and-trends/the-tokenization-revolution-reshaping-how-we-own-and-trade/487127,CryptoCurrency,1ji6o09,post,0.1779,0.159,0.0,0.841,1,0.841
2025-03-23 22:23:30,"Seems a ton of tokenization posts, this is the next bull run scheme.",4,0,https://www.reddit.com/r/CryptoCurrency/comments/1ji6o09/the_tokenization_revolution_reshaping_how_we_own/mjdup1n/,CryptoCurrency,mjdup1n,comment,0.0,0.0,0.0,1.0,0,1.0
2025-03-23 19:00:14,"tldr; The article discusses the transformation of the traditional financial system through Real-World Asset (RWA) tokenization, which is reshaping how assets like stocks, bonds, and real estate are owned and traded. This technology allows for 24/7 trading and fractional ownership, making high-value assets more accessible. Platforms like WhiteRock exemplify this trend by offering diverse portfolios and financial ecosystems, including stablecoins and lending options. The focus on security and transparency is crucial for building trust in this evolving market, marking a significant shift in the financial landscape.

*This summary is auto generated by a bot and not meant to replace reading the original article. As always, DYOR.",5,0,https://www.reddit.com/r/CryptoCurrency/comments/1ji6o09/the_tokenization_revolution_reshaping_how_we_own/mjcs3eg/,CryptoCurrency,mjcs3eg,comment,0.9493,0.179,0.0,0.821,1,0.821
2025-03-25 05:00:30,"This just sounds like a more expensive more risky security. Why would I buy tokenized real estate when I could just buy a real estate ETF? 


Also, 24/7 trading sounds cool, but is limited by liquidity and all the big exchanges are moving towards extended hours anyway.


I just don't get tokenization and would love to see actual useful examples.",1,0,https://www.reddit.com/r/CryptoCurrency/comments/1ji6o09/the_tokenization_revolution_reshaping_how_we_own/mjlvzyu/,CryptoCurrency,mjlvzyu,comment,0.897,0.223,0.06,0.717,1,0.717
2025-03-23 23:02:29,Time to buy more hbar,-1,0,https://www.reddit.com/r/CryptoCurrency/comments/1ji6o09/the_tokenization_revolution_reshaping_how_we_own/mje1rwu/,CryptoCurrency,mje1rwu,comment,0.0,0.0,0.0,1.0,0,1.0
2025-03-24 05:37:44,Polymesh joined the chat,-1,0,https://www.reddit.com/r/CryptoCurrency/comments/1ji6o09/the_tokenization_revolution_reshaping_how_we_own/mjfoq6g/,CryptoCurrency,mjfoq6g,comment,0.0,0.0,0.0,1.0,0,1.0
2025-03-23 22:26:15,Hedera is right here for this,-3,0,https://www.reddit.com/r/CryptoCurrency/comments/1ji6o09/the_tokenization_revolution_reshaping_how_we_own/mjdv6xm/,CryptoCurrency,mjdv6xm,comment,0.0,0.0,0.0,1.0,0,1.0
2025-03-23 21:17:27,Polygon joined the chat.,-2,0,https://www.reddit.com/r/CryptoCurrency/comments/1ji6o09/the_tokenization_revolution_reshaping_how_we_own/mjdijxi/,CryptoCurrency,mjdijxi,comment,0.0,0.0,0.0,1.0,0,1.0
2025-03-18 17:20:48,Coinbase study finds over 75% of institutional investors to increase crypto exposure ,26,8,https://www.theblock.co/post/346881/coinbase-study-finds-over-75-of-institutional-investors-to-increase-crypto-exposure?utm_source=feedly&utm_medium=rss,CryptoCurrency,1jeacex,post,0.3182,0.173,0.0,0.827,1,0.827
2025-03-18 17:41:47,Even at the software company I work I have been offered to move to a project about RWAs on Polygon. The world is embracing.,4,0,https://www.reddit.com/r/CryptoCurrency/comments/1jeacex/coinbase_study_finds_over_75_of_institutional/mih14jm/,CryptoCurrency,mih14jm,comment,0.0,0.0,0.0,1.0,0,1.0
2025-03-18 17:32:52,You know... Im something of an institutional investor myself,1,0,https://www.reddit.com/r/CryptoCurrency/comments/1jeacex/coinbase_study_finds_over_75_of_institutional/migz8ql/,CryptoCurrency,migz8ql,comment,0.0,0.0,0.0,1.0,0,1.0
2025-03-18 17:40:44,Just a little more and they will be 100%,1,0,https://www.reddit.com/r/CryptoCurrency/comments/1jeacex/coinbase_study_finds_over_75_of_institutional/mih0wh6/,CryptoCurrency,mih0wh6,comment,0.0,0.0,0.0,1.0,0,1.0
2025-03-18 18:22:47,Gotta make better regulations in order to build the legal infrastructure for institutional investors,1,0,https://www.reddit.com/r/CryptoCurrency/comments/1jeacex/coinbase_study_finds_over_75_of_institutional/mihak1x/,CryptoCurrency,mihak1x,comment,0.5267,0.268,0.0,0.732,1,0.732
2025-03-18 17:44:06,Those other 25% must be Peter Schiff level boomers.,0,0,https://www.reddit.com/r/CryptoCurrency/comments/1jeacex/coinbase_study_finds_over_75_of_institutional/mih1mdk/,CryptoCurrency,mih1mdk,comment,0.0,0.0,0.0,1.0,0,1.0
2025-03-19 14:21:21,Swiss bank Zuger Kantonalbank has added Cardano and Avalanche to its cryptocurrency offering through a partnership with Crypto focused bank Sygnum ,20,4,https://crypto.news/swiss-cantonal-bank-starts-offering-cardano-and-avalanche-to-meet-increased-demand/,CryptoCurrency,1jey481,post,0.3818,0.12,0.0,0.88,1,0.88
2025-03-19 14:30:07,"tldr; Swiss bank Zuger Kantonalbank has partnered with crypto-focused Sygnum Bank to offer Cardano (ADA) and Avalanche (AVAX) to meet increased customer demand. The service, accessible via e-banking and a mobile app, reflects growing regulatory clarity and the rising adoption of digital assets. Jan Damrau of Zuger Kantonalbank highlighted the convenience for clients to expand their crypto portfolios. Sygnum, valued at over $1 billion, recently raised $58 million in a funding round to support its growth.

*This summary is auto generated by a bot and not meant to replace reading the original article. As always, DYOR.",1,0,https://www.reddit.com/r/CryptoCurrency/comments/1jey481/swiss_bank_zuger_kantonalbank_has_added_cardano/mimh8c1/,CryptoCurrency,mimh8c1,comment,0.9477,0.199,0.014,0.787,1,0.787
2025-03-19 14:40:39,"If anyone was wondering what they already offered previously:

>In addition to Cardano (ADA) and Avalanche (AVAX), Zuger Kantonalbank’s crypto offering includes Bitcoin (BTC), Ethereum (ETH), Solana (SOL), XRP (XRP), Polygon (POL), Litecoin (LTC) and Uniswap (UNI).",1,0,https://www.reddit.com/r/CryptoCurrency/comments/1jey481/swiss_bank_zuger_kantonalbank_has_added_cardano/mimj8yo/,CryptoCurrency,mimj8yo,comment,0.0,0.0,0.0,1.0,0,1.0
2025-03-19 14:58:38,ALGO/HBAR,0,0,https://www.reddit.com/r/CryptoCurrency/comments/1jey481/swiss_bank_zuger_kantonalbank_has_added_cardano/mimmru8/,CryptoCurrency,mimmru8,comment,0.0,0.0,0.0,1.0,0,1.0
2025-03-19 14:49:09,I still think this is good for adoption because it gives less tech savvy people the opportunity to get some exposure to crypto,0,0,https://www.reddit.com/r/CryptoCurrency/comments/1jey481/swiss_bank_zuger_kantonalbank_has_added_cardano/mimkwcb/,CryptoCurrency,mimkwcb,comment,0.6908,0.222,0.0,0.778,1,0.778
2025-03-21 19:18:27,"A good way to promote a small app project? I've been developing a modest decentralized application for fun for a long time aimed at friends/colleagues using Polygon (see my profile to learn more) and I'm wondering what the best way would be to raise awareness of the project when you have limited resources (hoby, not a start-up).

Social network (which one?), presentation/pitch video, advertising, partnership, AI, special founder support program, ...  
==> What are you guys receptive to? Builders, what has worked for you?

Any good ideas or shared experiences would be appreciated ;)",2,2,https://www.reddit.com/r/CryptoCurrency/comments/1jgp0u4/a_good_way_to_promote_a_small_app_project/,CryptoCurrency,1jgp0u4,post,0.9798,0.272,0.017,0.711,1,0.711
2025-03-22 16:34:10,"most people only care about airdrop, hyped partnership, and token price appreciation (which can easily burn your wallet in non-bullish market like now). nobody really cares much about a crypto app outside of these things, sadly. if you have a hobby project and not an actual startup, i actually recommend you to make it cryptoless, you might have better genuine users that way.

if your app ""investigate"" other projects, you can get some audience by being super active on X (check how bubblemaps did it, they didnt have token for a very long time)",2,0,https://www.reddit.com/r/CryptoCurrency/comments/1jgp0u4/a_good_way_to_promote_a_small_app_project/mj61yl6/,CryptoCurrency,mj61yl6,comment,0.9725,0.248,0.026,0.726,1,0.726
2025-03-18 20:15:19,"7 Trends Shaping Web3, AI, And DePIN After ETH Denver 2025 ",2,1,https://www.forbes.com/sites/digital-assets/2025/03/18/7-trends-shaping-web3-ai-and-depin-after-eth-denver-2025/,CryptoCurrency,1jeep3f,post,0.0,0.0,0.0,1.0,0,1.0
2025-03-18 20:20:03,"tldr; ETH Denver 2025 showcased seven key trends shaping Web3, AI, and Decentralized Physical Infrastructure Networks (DePIN). Highlights included XYO's advancements in Proof of Location technology, Pudgy Penguins' animated series launch, SheFi's empowering event for women in blockchain, Polygon's focus on community-driven education, MetaMask's crypto debit card, Magic Eden's community-building efforts, and the growing integration of AI with Web3. These innovations emphasize collaboration, accessibility, and transformative potential in the blockchain ecosystem.

*This summary is auto generated by a bot and not meant to replace reading the original article. As always, DYOR.",1,0,https://www.reddit.com/r/CryptoCurrency/comments/1jeep3f/7_trends_shaping_web3_ai_and_depin_after_eth/mihz9bp/,CryptoCurrency,mihz9bp,comment,0.4588,0.043,0.0,0.957,1,0.957
2025-03-19 22:49:48,"Question to people who been here multiple bullruns: - New bullrun coins vs older bullrun coins? Hi everyone,

Older coins have potential to reach old highs. But newer coins get the discovery phase (after regaining cause most are now at lowest too) and maybe more hype? Im specifically asking people who been there for at least 1 previous bullrun.

Last bullrun i entered the market right before the crash (into the bearmarket). Made some profit and enjoyed the money but the remaining crypto is not doing well.

I see a lot of new coins in the top 100/200. Coins that were born in 2024 or something and now have downwards graphs that (almost), touch their beginning point.

I also see older crypto coins like ZIL, EGLD, Matic, Rose and many more that are now at the lowest.

This got me wondering. Both new and old coins have dying graphs. Which will perform better?

",2,21,https://www.reddit.com/r/CryptoMarkets/comments/1jfa7tx/question_to_people_who_been_here_multiple/,CryptoMarkets,1jfa7tx,post,0.7663,0.114,0.074,0.812,1,0.812
2025-03-19 22:56:52,"Actually good coins will perform well.

Some of the old ones have inflated too much, you should cut them.",2,0,https://www.reddit.com/r/CryptoMarkets/comments/1jfa7tx/question_to_people_who_been_here_multiple/mipbjgm/,CryptoMarkets,mipbjgm,comment,0.4404,0.216,0.091,0.693,1,0.693
2025-03-19 23:27:37,"Shitcoins are crazy percentage but like lottery, some dinocoins have volume",0,0,https://www.reddit.com/r/CryptoMarkets/comments/1jfa7tx/question_to_people_who_been_here_multiple/miphbmu/,CryptoMarkets,miphbmu,comment,0.3716,0.233,0.122,0.645,1,0.645
2025-03-19 22:49:48,"Question to people who been here multiple bullruns: - New bullrun coins vs older bullrun coins? Hi everyone,

Older coins have potential to reach old highs. But newer coins get the discovery phase (after regaining cause most are now at lowest too) and maybe more hype? Im specifically asking people who been there for at least 1 previous bullrun.

Last bullrun i entered the market right before the crash (into the bearmarket). Made some profit and enjoyed the money but the remaining crypto is not doing well.

I see a lot of new coins in the top 100/200. Coins that were born in 2024 or something and now have downwards graphs that (almost), touch their beginning point.

I also see older crypto coins like ZIL, EGLD, Matic, Rose and many more that are now at the lowest.

This got me wondering. Both new and old coins have dying graphs. Which will perform better?

",2,21,https://www.reddit.com/r/CryptoMarkets/comments/1jfa7tx/question_to_people_who_been_here_multiple/,CryptoMarkets,1jfa7tx,post,0.7663,0.114,0.074,0.812,1,0.812
2025-03-19 22:56:52,"Actually good coins will perform well.

Some of the old ones have inflated too much, you should cut them.",2,0,https://www.reddit.com/r/CryptoMarkets/comments/1jfa7tx/question_to_people_who_been_here_multiple/mipbjgm/,CryptoMarkets,mipbjgm,comment,0.4404,0.216,0.091,0.693,1,0.693
2025-03-19 23:27:37,"Shitcoins are crazy percentage but like lottery, some dinocoins have volume",0,0,https://www.reddit.com/r/CryptoMarkets/comments/1jfa7tx/question_to_people_who_been_here_multiple/miphbmu/,CryptoMarkets,miphbmu,comment,0.3716,0.233,0.122,0.645,1,0.645
2025-03-19 22:49:48,"Question to people who been here multiple bullruns: - New bullrun coins vs older bullrun coins? Hi everyone,

Older coins have potential to reach old highs. But newer coins get the discovery phase (after regaining cause most are now at lowest too) and maybe more hype? Im specifically asking people who been there for at least 1 previous bullrun.

Last bullrun i entered the market right before the crash (into the bearmarket). Made some profit and enjoyed the money but the remaining crypto is not doing well.

I see a lot of new coins in the top 100/200. Coins that were born in 2024 or something and now have downwards graphs that (almost), touch their beginning point.

I also see older crypto coins like ZIL, EGLD, Matic, Rose and many more that are now at the lowest.

This got me wondering. Both new and old coins have dying graphs. Which will perform better?

",2,21,https://www.reddit.com/r/CryptoMarkets/comments/1jfa7tx/question_to_people_who_been_here_multiple/,CryptoMarkets,1jfa7tx,post,0.7663,0.114,0.074,0.812,1,0.812
2025-03-19 22:56:52,"Actually good coins will perform well.

Some of the old ones have inflated too much, you should cut them.",2,0,https://www.reddit.com/r/CryptoMarkets/comments/1jfa7tx/question_to_people_who_been_here_multiple/mipbjgm/,CryptoMarkets,mipbjgm,comment,0.4404,0.216,0.091,0.693,1,0.693
2025-03-19 23:27:37,"Shitcoins are crazy percentage but like lottery, some dinocoins have volume",0,0,https://www.reddit.com/r/CryptoMarkets/comments/1jfa7tx/question_to_people_who_been_here_multiple/miphbmu/,CryptoMarkets,miphbmu,comment,0.3716,0.233,0.122,0.645,1,0.645
2025-03-25 03:21:16,"ETH Token Utility Is Deteriorating: A Rollup-Centric Ethereum Needs Rethinking This is not a price discussion about ETH token —this post focuses on Ethereum's evolving architecture and how current design choices affect ETH’s role within the protocol.

Specifically, I wanted to discuss (hopefully with Ethereum Foundation members and the community here) how Ethereum’s shift toward a rollup-centric architecture—combined with sequencer economics and abstracted fee mechanisms—is steadily eroding the utility of ETH as a protocol asset. As transaction execution moves off-chain and value accrues to application and infrastructure layers, ETH is becoming economically obsolete within its own ecosystem, reduced to a passive settlement token with declining relevance.

\_

Ethereum’s recent market underperformance reflects underlying architectural and economic challenges—namely, an increasing divergence between protocol-level activity and value accrual to the ETH token. As Ethereum transitions toward a modular architecture, with execution increasingly offloaded to Layer 2 rollups and sidechains, the locus of network activity and fee generation is shifting away from the base layer. This raises critical questions about ETH’s function as a utility and capital asset within a system where settlement and data availability remain on L1, but economic activity is abstracted and fragmented across secondary layers.

Layer 2 networks and Ethereum-adjacent sidechains increasingly leverage Ethereum’s ecosystem—its security model, TVL, and EVM compatibility—while largely bypassing ETH as a core economic asset. These platforms benefit from Ethereum’s ecosystem, but redirect liquidity, transaction volume, and value accrual to their own native tokens and network.

Polygon, for example, positioned itself early on as an Ethereum scaling solution and received support from Ethereum Foundation + Vitalik. However, its architecture relies on its own validators, consensus model, and token (MATIC/POL), which is used for both transaction fees and staking. As a result, Polygon leeches from Ethereum's network, TVL, and developer network without reinforcing ETH as a utility token or contributing to the security of Ethereum mainnet.

L2 solutions such as Base, Arbitrum, and Optimism are structurally closer to Ethereum, in that they settle data to Layer 1. However, their economic models often do not reinforce ETH demand in a meaningful way. Sequencers collect fees and periodically post transaction data to Ethereum mainnet using ETH or their own native UI currencies—but in many cases (e.g., Coinbase’s Base), this ETH is sold immediately. The result is an increase in ETH-denominated sell pressure for using a L2 network without any corresponding increase in demand or utility. The amount of ETH burned is extremely small compared to the value being moved across these L2s. For billions in daily transaction volume, the total ETH burned is typically in the hundreds to low thousands per month. So while ETH is used, it’s economically disproportionate to the scale of activity happening off-chain.

Moreover, the abstraction of ETH from end users further erodes its role as a utility token. If rollups and applications can operate entirely using other network-specific tokens, and if ETH is only used behind the scenes (and immediately sold), its function as a transactional or capital asset becomes increasingly marginal. In effect, ETH risks being reduced to a mere settlement token for rollup operators, rather than a broadly used currency or store of value within the ecosystem.

The Ethereum Foundation continues to champion a rollup-centric roadmap as the path toward scalable, decentralized infrastructure. While this model offers tangible benefits—lower transaction costs/higher throughput—it also creates new economic trade-offs. Value accrual shifts to application and infrastructure layers, rather than consolidating around the base protocol asset (ETH). This is a departure from Ethereum’s earlier design assumptions, where ETH was envisioned as a multi-functional asset: the native gas token, staking collateral, medium of exchange, and reserve currency for decentralized applications.

As a long-time participant in the Ethereum ecosystem (since 2015-2016 or so), I’ve observed this shift with increasing concern—not due to a lack of technical progress, but due to the weakening alignment between protocol growth and ETH value. Ethereum is scaling, but ETH is not capturing the upside of that scale. Competing ecosystems—such as Solana or vertically integrated L1s—are increasingly offering tighter economic alignment between usage and token utility, which may present challenges to Ethereum’s long-term competitiveness.

This is a critical juncture. Ethereum must balance scalability with economic coherence. If Ethereum becomes primarily a settlement layer for EVM-compatible rollups that abstract away ETH, then ETH’s utility—and by extension, its long-term value proposition—will disappear.

\_

TL;DR: ETH is being abstracted away from Ethereum network + ecosystem usage, and needs to be fixed.

I'm highlighting a critical design problem where there’s a growing disconnect between network expansion and economic incentives for the ETH token.

This is fundamentally an architectural/incentive issue that needs to be addressed to preserve ETH’s role (the token ETH not the network) in the new age of a rollup-centric ethereum, (and not be completely abstracted away)

in the comments I've outlined potential solutions—such as ETH-denominated fee-sharing models and collateral requirements for L2 sequencers—that would re-align ETH with L2 usage. Today, the Ethereum Ecosystem is growing, but ETH utility continues deteriorate as the token is sidelined from actual transaction flow and user interaction on l2s.",14,52,https://www.reddit.com/r/ethereum/comments/1jja457/eth_token_utility_is_deteriorating_a/,ethereum,1jja457,post,0.9965,0.111,0.033,0.856,1,0.856
2025-03-25 03:21:17,"WARNING ABOUT SCAMS:  Recently there have been a lot of convincing-looking scams posted on crypto-related reddits including fake NFTs, fake credit cards, fake exchanges, fake mixing services, fake airdrops, fake MEV bots, fake ENS sites and scam sites claiming to help you revoke approvals to prevent fake hacks. These are typically upvoted by bots and seen before moderators can remove them. Do not click on these links and always be wary of anything that tries to rush you into sending money or approving contracts.


*I am a bot, and this action was performed automatically. Please [contact the moderators of this subreddit](/message/compose/?to=/r/ethereum) if you have any questions or concerns.*",1,0,https://www.reddit.com/r/ethereum/comments/1jja457/eth_token_utility_is_deteriorating_a/mjljace/,ethereum,mjljace,comment,-0.9864,0.063,0.288,0.649,-1,0.649
