date,text,score,comments,url,subreddit,id,type,sentiment_compound,sentiment_positive,sentiment_negative,sentiment_neutral,sentiment_class,sentiment_confidence
2025-03-23 19:51:32,"Yesterday in Ethereum, Sunday, March 23, 2025 Ethereum is the obvious blockchain to do tokenization on, said BlackRock's (biggest asset manager in the world) Head of Digital Assets at the Blockworks Digital Asset Summit. /u/ethmaxitard transcribed some of it [in the Daily](https://old.reddit.com/r/ethereum/comments/1jga3s3/daily_general_discussion_march_21_2025/mixkdxd/) (or watch [the video](https://www.youtube.com/live/ZElYvaq0JTQ?t=6609s)): ""When you look at our experience, take BUIDL for example, there was no question that the blockchain that we would start our tokenization on would be Ethereum. And that’s not just a Blackrock thing, that’s really anybody who would enter this space. That’s the natural default answer."" BUIDL is Blackrock's tokenized US Treasury fund. Blackrock also has the leading [ETH ETF](https://farside.co.uk/eth/). See also /u/Ethzenn's reply: ""What country is going to tokenize their stock market on a blockchain owned by an American company. Decentralization is the only way a blockchain can become the foundation of global finance. And there's only one blockchain with that credibility."" Credible neutrality is indeed one of Ethereum's core value propositions.  

Some other companies that have explicitly chosen Ethereum are Coinbase and Microsoft. Contrast this with Ethena and Securitize's decision to launch a new permissioned and KYCd chain. Bankless, on [their latest weekly Rollup podcast](https://www.youtube.com/watch?v=uqSeASPs5yg), makes a good argument as to why they're wrong: private chains have been tried without success for years; Coinbase is more likely to succeed with KYCd pools on their Base rollup (covered in a [recent Yesterday in Ethereum](https://www.reddit.com/r/ethereum/comments/1jf2j7z/understanding_new_financial_tools_on_ethereum/?)) than Ethena and Securitize are. 

The Depository Trust & Clearing Corporation (DTCC), which settles most US securities transactions, [joined](https://www.dtcc.com/news/2025/march/20/dtcc-joins-erc3643-association) the [ERC3643 Association](https://www.erc3643.org/). [ERC-3643](https://eips.ethereum.org/EIPS/eip-3643) is a standard for permissioned real-world assets (RWA): securities. 

Privacy protocol Tornado Cash was finally [removed](https://home.treasury.gov/news/press-releases/sb0057) ([address list](https://ofac.treasury.gov/recent-actions/20250321)) from the US OFAC sanctions list, [long after the US government lost in court](https://x.com/iampaulgrewal/status/1903145037552365681). US prosecutors [still haven't dropped](https://x.com/rstormsf/status/1903132943725498793) their case against Tornado Cash developer Roman Storm; another developer, Alexey Pertsev, is being prosecuted in the Netherlands; and developer Roman Semenov remains sanctioned by OFAC... all for developing privacy software. 

News from the latest All Core Devs call: The Pectra mainnet upgrade date will be decided after the Hoodi testnet forks to Pectra on March 26th. Expiration of pre-Merge history (saving storage space for nodes) was planned for May 1, but will happen after Pectra goes live, since it needs one of the updates in Pectra. There's also been more testing of a 60 million gas limit. See [Christine Kim's summary](https://www.galaxy.com/insights/research/ethereum-all-core-developers-consensus-call-153/) or the official [Ethereum Magicians thread](https://ethereum-magicians.org/t/consensus-layer-call-153/23097/3). 

There were some [bridge recommendations](https://old.reddit.com/r/ethereum/comments/1jga3s3/daily_general_discussion_march_21_2025/mj0ihpt/) in the Daily. The ones I see most recommended are bridge aggregator [Jumper](https://jumper.exchange/) and the [Across](https://across.to/) bridge. 

You may have seen a thread here in /r/ethereum asking [what the best L2 was](https://old.reddit.com/r/ethereum/comments/1jgc519/whats_considered_the_best_l2_right_now/). People in the thread loved Base. I suspect if you asked in the Daily it would lean more towards Arbitrum. 

There are regular Ethereum L2 interop calls now. Their goal is “solving interop” = there is no meaningful difference to users between using a single chain and using many chains. Their near-term goal: fast, easy, trust-minimized movement of assets across any chain. It looks like we'll see quick progress towards these goals: see [the roadmap](https://x.com/rudolf6_/status/1902847134388588988). If you want to learn more, you can [read the notes](https://notes.ethereum.org/@rudolf/interop-all-notes) from the calls or listen to them. Note that ""intents"" means you tell the software what you want to do and solvers compete to do it for you,  without you having to know the details (e.g. what chain it happens on). 

The US Congress is on track for stablecoin and crypto market structure bills [by around August](https://cointelegraph.com/news/congress-stablecoin-market-structure-bills-august-blockchain-association). See also my summary of stablecoin legislation in [a previous](https://www.reddit.com/r/ethereum/comments/1jc3kwp/yesterday_in_ethereum_march_15_2025/?) Yesterday in Ethereum. 

Wyoming will [soon start testing](https://governor.wyo.gov/news-releases/wyoming-stable-token-commission-advances-toward-historic-launch-of-first-ever-publicly-issued-stable-token) a publicly-issued, fiat-backed stablecoin. ""The Commission is currently in negotiations with the top-ranked participants to finalize contracts."" There are nine Candidate Blockchains, including Solana, Ethereum, Avalanche, Sui, Stellar, Polygon, Arbitrum, Base, and Optimism, and they're considering a multi-chain deployment. They're targeting a July launch for Wyoming Stable Token (WYST). 

We're making further progress against debanking crypto customers: The Office of the Comptroller of the Currency (OCC) updated its supervisory handbook to [remove “reputational risk”](https://www.coindesk.com/policy/2025/03/20/u-s-bank-agency-cuts-reputational-risk-from-exams-after-crypto-sector-cites-issues) from the factors banks must consider when onboarding clients. That had been used to debank crypto customers. 

Aztec is an impressive privacy project. They're working on a private layer 2, due out later this year. That will be their third generation privacy project; they've deprecated the first two. They're [offering $150K](https://x.com/aztecnetwork/status/1902743106434556245) for teams to build bridges to Aztec, which will allow apps on any L2 to bring privacy to their users without the assets having to migrate to Aztec.

The [definitive Holešky Post-Mortem](https://github.com/ethereum/pm/blob/master/Pectra/holesky-postmortem.md) is out, and it links to some others, like the Besu one we summarized in [a previous Yesterday](https://www.reddit.com/r/ethereum/comments/1je8ski/yesterday_in_ethereum_march_18_2025/?). We learned a lot from that testnet failure. 

In case you missed it, there was also a whole [good thread](https://ethereum-magicians.org/t/pectra-retrospective/22637) about how the Pectra upgrade process went and how we can do it better in the future. We're improving processes and getting better and faster at doing upgrades.  

EthStaker ([Reddit](https://old.reddit.com/r/ethstaker/), [website](https://ethstaker.org/)) is out with their [Ethereum Staking Survey 2025](https://ethstaker.org/forms/staking-landscape-survey-2025) ""The survey is open to ANYBODY: if you hold LSTs..."" See also their [2024 results](https://paragraph.xyz/@ethstaker/staking-survey-2024). 

Coinbase is [in talks to acquire](https://www.bloomberg.com/news/articles/2025-03-21/coinbase-in-advanced-talks-to-buy-derivatives-venue-deribit-coin) futures exchange [Deribit](https://www.deribit.com/), and Kraken [is buying](https://www.bloomberg.com/news/articles/2025-03-20/kraken-to-acquire-futures-platform-ninjatrader-for-1-5-billion) futures exchange [NinjaTrader](https://ninjatrader.com/futures/futures-contracts/cryptocurrency/). 

For your entertainment, here's a good [troll of Bitcoin](https://x.com/evan_van_ness/status/1902377018706293178) by Evan Van Ness /u/EvanVanNess. Background: Bitcoin, Solana, and other blockchains have been in a narrative war against Ethereum for a long time, while we've mostly stayed out of it till recently, when we decided to start fighting back. 

In case you missed it: our [previous Yesterday in Ethereum](https://www.reddit.com/r/ethereum/comments/1jfu5yu/yesterday_in_ethereum_march_20_2025/).",57,7,https://www.reddit.com/r/ethereum/comments/1ji80kr/yesterday_in_ethereum_sunday_march_23_2025/,ethereum,1ji80kr,post,0.9955,0.099,0.036,0.865,1,0.865
2025-03-23 20:15:34,these are real good,10,0,https://www.reddit.com/r/ethereum/comments/1ji80kr/yesterday_in_ethereum_sunday_march_23_2025/mjd6k7n/,ethereum,mjd6k7n,comment,0.4404,0.492,0.0,0.508,1,0.508
2025-03-23 21:05:21,All of this is just very good to hear after the past few weeks. And months. Thank you :),3,0,https://www.reddit.com/r/ethereum/comments/1ji80kr/yesterday_in_ethereum_sunday_march_23_2025/mjdga4o/,ethereum,mjdga4o,comment,0.8268,0.352,0.0,0.648,1,0.648
2025-03-23 21:32:27,World Liberty Financial also got products in the pipeline to bring tradfi on chain. Trump family support and us treasury. Lots of rwas going that route as well. Seems like once bills are in place for stable coins we should see lots of positive activity on ethereum as well. Current administration is moving us into the world of web3. Fingers crossed its all happening this bull cycle.,2,0,https://www.reddit.com/r/ethereum/comments/1ji80kr/yesterday_in_ethereum_sunday_march_23_2025/mjdlcrt/,ethereum,mjdlcrt,comment,0.9545,0.257,0.0,0.743,1,0.743
2025-03-23 23:53:14,So eth to 800?,2,0,https://www.reddit.com/r/ethereum/comments/1ji80kr/yesterday_in_ethereum_sunday_march_23_2025/mjeavpz/,ethereum,mjeavpz,comment,0.0,0.0,0.0,1.0,0,1.0
2025-03-25 03:21:16,"ETH Token Utility Is Deteriorating: A Rollup-Centric Ethereum Needs Rethinking This is not a price discussion about ETH token —this post focuses on Ethereum's evolving architecture and how current design choices affect ETH’s role within the protocol.

Specifically, I wanted to discuss (hopefully with Ethereum Foundation members and the community here) how Ethereum’s shift toward a rollup-centric architecture—combined with sequencer economics and abstracted fee mechanisms—is steadily eroding the utility of ETH as a protocol asset. As transaction execution moves off-chain and value accrues to application and infrastructure layers, ETH is becoming economically obsolete within its own ecosystem, reduced to a passive settlement token with declining relevance.

\_

Ethereum’s recent market underperformance reflects underlying architectural and economic challenges—namely, an increasing divergence between protocol-level activity and value accrual to the ETH token. As Ethereum transitions toward a modular architecture, with execution increasingly offloaded to Layer 2 rollups and sidechains, the locus of network activity and fee generation is shifting away from the base layer. This raises critical questions about ETH’s function as a utility and capital asset within a system where settlement and data availability remain on L1, but economic activity is abstracted and fragmented across secondary layers.

Layer 2 networks and Ethereum-adjacent sidechains increasingly leverage Ethereum’s ecosystem—its security model, TVL, and EVM compatibility—while largely bypassing ETH as a core economic asset. These platforms benefit from Ethereum’s ecosystem, but redirect liquidity, transaction volume, and value accrual to their own native tokens and network.

Polygon, for example, positioned itself early on as an Ethereum scaling solution and received support from Ethereum Foundation + Vitalik. However, its architecture relies on its own validators, consensus model, and token (MATIC/POL), which is used for both transaction fees and staking. As a result, Polygon leeches from Ethereum's network, TVL, and developer network without reinforcing ETH as a utility token or contributing to the security of Ethereum mainnet.

L2 solutions such as Base, Arbitrum, and Optimism are structurally closer to Ethereum, in that they settle data to Layer 1. However, their economic models often do not reinforce ETH demand in a meaningful way. Sequencers collect fees and periodically post transaction data to Ethereum mainnet using ETH or their own native UI currencies—but in many cases (e.g., Coinbase’s Base), this ETH is sold immediately. The result is an increase in ETH-denominated sell pressure for using a L2 network without any corresponding increase in demand or utility. The amount of ETH burned is extremely small compared to the value being moved across these L2s. For billions in daily transaction volume, the total ETH burned is typically in the hundreds to low thousands per month. So while ETH is used, it’s economically disproportionate to the scale of activity happening off-chain.

Moreover, the abstraction of ETH from end users further erodes its role as a utility token. If rollups and applications can operate entirely using other network-specific tokens, and if ETH is only used behind the scenes (and immediately sold), its function as a transactional or capital asset becomes increasingly marginal. In effect, ETH risks being reduced to a mere settlement token for rollup operators, rather than a broadly used currency or store of value within the ecosystem.

The Ethereum Foundation continues to champion a rollup-centric roadmap as the path toward scalable, decentralized infrastructure. While this model offers tangible benefits—lower transaction costs/higher throughput—it also creates new economic trade-offs. Value accrual shifts to application and infrastructure layers, rather than consolidating around the base protocol asset (ETH). This is a departure from Ethereum’s earlier design assumptions, where ETH was envisioned as a multi-functional asset: the native gas token, staking collateral, medium of exchange, and reserve currency for decentralized applications.

As a long-time participant in the Ethereum ecosystem (since 2015-2016 or so), I’ve observed this shift with increasing concern—not due to a lack of technical progress, but due to the weakening alignment between protocol growth and ETH value. Ethereum is scaling, but ETH is not capturing the upside of that scale. Competing ecosystems—such as Solana or vertically integrated L1s—are increasingly offering tighter economic alignment between usage and token utility, which may present challenges to Ethereum’s long-term competitiveness.

This is a critical juncture. Ethereum must balance scalability with economic coherence. If Ethereum becomes primarily a settlement layer for EVM-compatible rollups that abstract away ETH, then ETH’s utility—and by extension, its long-term value proposition—will disappear.

\_

TL;DR: ETH is being abstracted away from Ethereum network + ecosystem usage, and needs to be fixed.

I'm highlighting a critical design problem where there’s a growing disconnect between network expansion and economic incentives for the ETH token.

This is fundamentally an architectural/incentive issue that needs to be addressed to preserve ETH’s role (the token ETH not the network) in the new age of a rollup-centric ethereum, (and not be completely abstracted away)

in the comments I've outlined potential solutions—such as ETH-denominated fee-sharing models and collateral requirements for L2 sequencers—that would re-align ETH with L2 usage. Today, the Ethereum Ecosystem is growing, but ETH utility continues deteriorate as the token is sidelined from actual transaction flow and user interaction on l2s.",17,52,https://www.reddit.com/r/ethereum/comments/1jja457/eth_token_utility_is_deteriorating_a/,ethereum,1jja457,post,0.9965,0.111,0.033,0.856,1,0.856
2025-03-25 03:21:17,"WARNING ABOUT SCAMS:  Recently there have been a lot of convincing-looking scams posted on crypto-related reddits including fake NFTs, fake credit cards, fake exchanges, fake mixing services, fake airdrops, fake MEV bots, fake ENS sites and scam sites claiming to help you revoke approvals to prevent fake hacks. These are typically upvoted by bots and seen before moderators can remove them. Do not click on these links and always be wary of anything that tries to rush you into sending money or approving contracts.


*I am a bot, and this action was performed automatically. Please [contact the moderators of this subreddit](/message/compose/?to=/r/ethereum) if you have any questions or concerns.*",1,0,https://www.reddit.com/r/ethereum/comments/1jja457/eth_token_utility_is_deteriorating_a/mjljace/,ethereum,mjljace,comment,-0.9864,0.063,0.288,0.649,-1,0.649
2025-03-25 03:34:28,"Yes and no. The fact that ETH is the backbone of so many other layers of the Web3 ecosystem is, in its own way, more meaningful in terms of staying power than any other currency.",27,0,https://www.reddit.com/r/ethereum/comments/1jja457/eth_token_utility_is_deteriorating_a/mjll5dc/,ethereum,mjll5dc,comment,0.4754,0.134,0.056,0.81,1,0.81
2025-03-25 04:14:16,">reduced to a passive settlement token with declining relevance.

You mean: the only token used to settle L2 transactions on L1, thus ensuring its relevancy long term? This is like saying VISA is irrelevant because they ""only"" settle transactions between acquiring banks and issuing banks.

>raising important questions about ETH’s role and utility within this new paradigm.

eth's role is as the currency of payment for performing work on the ethereum L1 blockchain. With the advent of L2s, that is shifting more to a settlement layer while maintaining security and decentralisation, since the L2s are handling scalability. I don't think anyone is questioning this role, or eth's utility. This reads like FUD.

>their \[L2s\] economic models often do not reinforce ETH demand in a meaningful way

No, because that's not their job... Their job is to scale the ethereum network, utilising L1 and eth as a settlement layer. Propping up the value of eth is not their aim, so I'm not sure why you would think to even list this as an issue?

>the abstraction of ETH from end users further erodes its role as a utility token

Nonsense. Eth is trivially available to end users and has the same utility as ever.

>if ETH is only used behind the scenes (and immediately sold)

Eth being sold doesn't mean it disappears... it's sold to someone else who then uses it for its intended purpose.

>its function as a transactional or capital asset becomes increasingly marginal

Neither of which is a goal of eth. See above, re: eth's role

>ETH risks being reduced to a mere settlement token for rollup operators, rather than a broadly used currency or store of value within the ecosystem.

Much like oil in the global economy... hey, maybe that's why transaction fees are paid for with ""gas""!

>Competing ecosystems—such as Solana or vertically integrated L1s—are increasingly offering tighter economic alignment between usage and token utility, which may present challenges to Ethereum’s long-term competitiveness

All I'm reading here is that the price of sol is artificially and unnecessarily high compared to eth. As above, ethereum's long-term competitiveness is as a settlement layer.

>If Ethereum becomes primarily a settlement layer for EVM-compatible rollups that abstract away ETH, then ETH’s utility—and by extension, its long-term value proposition—will disappear.

No, eth's utility remains the same... anyone can purchase it and use it in a variety of ways, including interacting directly with L1. It's long term value proposition is also unchanged. Eth is and has always afaik positioned itself as the oil, to bitcoin's gold. Imagine saying all this stuff about oil? That's how you sound to me.",16,0,https://www.reddit.com/r/ethereum/comments/1jja457/eth_token_utility_is_deteriorating_a/mjlqggd/,ethereum,mjlqggd,comment,0.9238,0.077,0.039,0.884,1,0.884
2025-03-25 04:05:49,"Onboard the world onto Ethereum now, care about fee revenue later. Even with gas at 1 gwei Ethereum is less inflationary than BTC and even L1 is cheap to transact on, so I don't see where the problem is. We're just allowing devs and users to find *that thing* that will onboard the whole world onto Ethereum, then you can start caring about fee revenue but you won't need to and won't even remember this post.",14,0,https://www.reddit.com/r/ethereum/comments/1jja457/eth_token_utility_is_deteriorating_a/mjlpdc9/,ethereum,mjlpdc9,comment,0.3291,0.055,0.024,0.921,1,0.921
2025-03-25 07:29:09,"The time to post things like this was in 2020 when the rollup roadmap was discussed, or 2021 and 2024 when the price was at peak. 


To be reactive to price action makes no sense here.


Some of your points even seem straight out from 2020. Polygon has not been relevant for many years. They're a dying chain who may have gotten some mainstream media press in Polymarket, but in practice volume and activity is steadily losing out to actual rollups.


Other points are plain misinformed. Base has not been selling the ETH it accrues.


More importantly, Optimism, Arbitrum and Base do NOT have native UI currencies as you seem to believe. They use ETH for gas.


This is true for the vast majority of rollups. Some gas abstraction solutions exist, but they're used in microscopic volume. The only two rollups I can recall off the top of my head with their own gas token is Metis and... some other irrelevant one I can't even remember.


You claim you are a longtime participant in this ecosystem. As an actual daily user of Ethereum, I suspect your participation is limited to having bought coins early on, and you do not actually use Ethereum. 


I suggest using Ethereum. It will clear up many of your misconceptions, and you will be in a much better position to judge the roadmap.",8,0,https://www.reddit.com/r/ethereum/comments/1jja457/eth_token_utility_is_deteriorating_a/mjmak7o/,ethereum,mjmak7o,comment,0.9247,0.109,0.055,0.836,1,0.836
2025-03-25 06:37:39,"I appreciate the thought and effort you've put into this post. I have a question about something you said. I hope it's not too basic of a question.

You said:

Sequencers collect fees and periodically post transaction data to Ethereum mainnet using ETH-but in many cases (e.g., Coinbase's Base), this ETH is sold rather than staked or reinvested within the ecosystem.

Don't L2s have to pay fees in ETH to settle on L1? When you say ""meaningful way"" do you mean that this amounts to a negligible amount compared to the total value that moves in L2s?

What do you mean when you say this eth is sold rather than reinvested or stacked?",3,0,https://www.reddit.com/r/ethereum/comments/1jja457/eth_token_utility_is_deteriorating_a/mjm5thj/,ethereum,mjm5thj,comment,0.857,0.095,0.012,0.893,1,0.893
2025-03-25 05:38:55,"“This is not a price discussion about ETH token” - proceeds to talk exclusively about why the price might be low.

The price of ETH is secondary. It needs to be high enough to secure the chain, and it is. Scaling through L2s works amazingly well. Cross-L2 UX needs to get 10x better. That’s the kind of thing that matters to users.",5,0,https://www.reddit.com/r/ethereum/comments/1jja457/eth_token_utility_is_deteriorating_a/mjm049o/,ethereum,mjm049o,comment,0.6901,0.133,0.032,0.835,1,0.835
2025-03-25 07:27:34,Imagine thinking prices are driven by token Utility instead of narratives.,2,0,https://www.reddit.com/r/ethereum/comments/1jja457/eth_token_utility_is_deteriorating_a/mjmaf4h/,ethereum,mjmaf4h,comment,0.0,0.0,0.0,1.0,0,1.0
2025-03-25 07:39:16,"As a fellow follower of the Ethereum development since 2017, I still have issues to understand its real world use case. The concept of decentralized ownership never materialized nor any dApp has been really disruptive on a global scale. People use Ethereum to create their own tokens instead.

I will get downvoted but I will argue that ETH as a store of value lost the competition against Bitcoin. Would you save your economic energy in ETH rather than BTC ?",1,0,https://www.reddit.com/r/ethereum/comments/1jja457/eth_token_utility_is_deteriorating_a/mjmbgh0/,ethereum,mjmbgh0,comment,0.5794,0.136,0.092,0.772,1,0.772
2025-03-25 07:58:43,"The rollup centric roadmap was less a shift away from the original goals and more about a prediction: that by the time Ethereum implemented proper sharding, everyone would already be using rollups and no one would care about the shards. That prediction doesn’t seem to be totally accurate, but the amount of activity around developing rollups is advancing the R&D necessary to make shards happen much faster than if it was only the client teams and eth magicians working on it. The existence of rollups was inevitable though, they weren’t a direction that was decided on, it was an inevitable evolution of the space that ethereum could choose to leverage. Ethereum positioned itself as the de facto security and coordination layer of rollups. If it hadn’t done that, the rollups would still exist, but ethereum may not have been where they rolled up into. 

Rollups are not parasites to be tariffed, they are allies that have the same long term vision and principals we do. They’re following the lead of ethereum, and that kind of power can only be earned. Growing together towards a shared goal is, and has always been, the best way forward.

The crypto market is filled with people trying to get rich quick. It’s not a rational long term prediction of Ethereum or crypto. ",1,0,https://www.reddit.com/r/ethereum/comments/1jja457/eth_token_utility_is_deteriorating_a/mjmd79v/,ethereum,mjmd79v,comment,0.9738,0.109,0.007,0.884,1,0.884
